{"$id":"https://justinahiggins614-cmyk.github.io/signature-experiment-solver/manifest.schema.json","$schema":"https://json-schema.org/draft/2020-12/schema","description":"The single authoritative experiment-manifest.json. Every counter on the page, the API feed, and the sitemap derive from this file; builds fail on any disagreement.","properties":{"archive_version":{"type":"string"},"canonical_url":{"type":"string"},"chunk_count":{"type":"integer"},"chunk_size":{"type":"integer"},"deep_link_pattern":{"type":"string"},"disciplines":{"items":{"type":"string"},"type":"array"},"earliest_exp_id":{"pattern":"^JAH-EXP-\\d{6}$","type":"string"},"goal":{"type":"integer"},"hashes_file":{"type":"string"},"hashes_hash":{"pattern":"^sha256:[0-9a-f]{64}$","type":"string"},"honesty":{"type":"string"},"index_hash":{"pattern":"^sha256:[0-9a-f]{64}$","type":"string"},"index_version":{"type":"string"},"last_updated":{"type":"string"},"latest_exp_id":{"pattern":"^JAH-EXP-\\d{6}$","type":"string"},"license":{"type":"string"},"prng_algorithm":{"type":"string"},"schema_version":{"const":"JAH-EXP-RECORD/1.0","type":"string"},"seed_algorithm":{"type":"string"},"site_id":{"type":"string"},"site_name":{"type":"string"},"site_version":{"type":"string"},"solver_engine":{"const":"SOLVER-ENGINE-V1","type":"string"},"solver_engine_version":{"type":"string"},"total_experiments":{"type":"integer"},"total_simulations":{"type":"integer"},"total_solver_types":{"type":"integer"},"total_validated_experiments":{"type":"integer"}},"required":["site_id","site_name","site_version","schema_version","total_experiments","total_solver_types","total_simulations","total_validated_experiments","earliest_exp_id","latest_exp_id","index_hash","hashes_hash","solver_engine","solver_engine_version","seed_algorithm","last_updated","honesty"],"title":"experiment-manifest.json — Authoritative Archive Manifest","type":"object"}