{
 "site_id": "SIGNATURE-EXPERIMENT-SOLVER",
 "site_name": "The Signature Experiment Solver",
 "site_version": "1.0",
 "archive_version": "2026-10-03",
 "schema_version": "JAH-EXP-RECORD/1.0",
 "total_experiments": 35925,
 "total_solver_types": 240,
 "total_simulations": 35925,
 "total_validated_experiments": 0,
 "earliest_exp_id": "JAH-EXP-000001",
 "latest_exp_id": "JAH-EXP-035925",
 "index_version": "1.0",
 "index_hash": "sha256:e7cb286e62a7f7684ef0e4eb53eecbc9bc75f7f29d9c4de3f55dc21c97d6976f",
 "hashes_file": "data/hashes.json.gz",
 "hashes_hash": "sha256:d79ad271604816f3cc304bcb087f55b4d9cad7fc291226a2c6e68932a2baff1b",
 "solver_engine": "SOLVER-ENGINE-V1",
 "solver_engine_version": "1.0",
 "seed_algorithm": "FNV-1a-32",
 "prng_algorithm": "mulberry32",
 "chunk_size": 150,
 "chunk_count": 240,
 "goal": 1000000,
 "disciplines": [
  "Biology",
  "Chemistry",
  "Computer Science",
  "Earth & Space",
  "Economics & Math",
  "Engineering",
  "Environmental",
  "Physics",
  "Psychology"
 ],
 "last_updated": "2026-10-05T15:08:04Z",
 "honesty": "All numeric results are solver-computed simulations, labeled as such; never presented as measured lab data.",
 "license": "Original solver-generated works by the Signature system.",
 "canonical_url": "https://justinahiggins614-cmyk.github.io/signature-experiment-solver/",
 "deep_link_pattern": "https://justinahiggins614-cmyk.github.io/signature-experiment-solver/?exp=JAH-EXP-000001"
}